{
  "request_id": "urn:uuid:a1b2c3d4-e5f6-7890-abcd-ef1234567890",
  "intent_id": "urn:uuid:550e8400-e29b-41d4-a716-446655440000",
  "delegation_id": "urn:uuid:7f3e9a12-b4c8-4d56-a321-8b7c6d5e4f30",
  "buyer_agent_id": "did:act:example.com/agent-alice-001",
  "intent_context": {
    "explicit_intent": "续费中国移动手机号 138xxxxxxxx 的套餐",
    "implicit_intent": ["月度自动续费", "套餐价格约 129 元"],
    "preferences": ["偏好原套餐不变"]
  },
  "constraints": {
    "max_amount": 150.00,
    "currency": "CNY",
    "allowed_merchants": ["urn:act:merchant:example-merchant"]
  },
  "response_requirements": {
    "max_candidates": 3,
    "sort_preference": "relevance"
  },
  "timestamp": "2026-04-19T08:00:00Z"
}